{
  "schema_version": 1,
  "scope": "representative_unit",
  "participant": {
    "id": "g4-independent-ai-learner-v2",
    "type": "independent-ai",
    "roles": [
      "isolated learner"
    ]
  },
  "runner_session_id": "g4-cold-ai-session-20261018-c",
  "isolated_context_id": "g4-cold-ai-context-20261018-c",
  "allowed_inputs": [
    {
      "kind": "learner-page",
      "path": "course/unit-3.html",
      "sha256": "3d6f918545b41c18edc78381d9b03346db49649d61d009ed6d8cad86e5257b72"
    },
    {
      "kind": "learner-asset",
      "path": "course/styles.css",
      "sha256": "6ca8d204e3bf39a00d76b7868f0d5ea4322b96eadc83086d619ea9d91b923a4b"
    },
    {
      "kind": "learner-asset",
      "path": "course/assets/campaign-data.csv",
      "sha256": "6ce1da5dc15dc131b8fae9422c88356397047343ee37461d64c4b27594efb103"
    },
    {
      "kind": "learner-asset",
      "path": "course/assets/brief-template.md",
      "sha256": "a0c35ba9df076f6352e037ba4de599370b6ecc622ead2969ff99c78e4c065d0c"
    },
    {
      "kind": "learner-asset",
      "path": "course/assets/rubric.md",
      "sha256": "e95059475235c93b9556f8e298d2b67d5042b7d321d13f9ffdea8022d23c8370"
    }
  ],
  "forbidden_inputs_accessed": [],
  "entry": {
    "started_at": "2026-10-18T07:17:00Z",
    "page": "course/unit-3.html",
    "goal_understood": true,
    "materials_found": true
  },
  "actions": [
    {
      "sequence": 1,
      "action": "閱讀單元三頁面並辨識完成目標。",
      "observable_result": "確認要把三個活動的完整指標表轉成達標判讀、資料界線與可執行下一步。",
      "at": "2026-10-18T07:17:20Z"
    },
    {
      "sequence": 2,
      "action": "讀取頁面樣式與三個學員素材。",
      "observable_result": "找到 CSV 原始數據、摘要模板、五項驗收規則，並確認頁面內容可讀。",
      "at": "2026-10-18T07:17:50Z"
    },
    {
      "sequence": 3,
      "action": "依指定公式重算三個活動的 CTR、CVR、平均 CPC、CPA 與 ROAS。",
      "observable_result": "得到 Brand Search 8.00%、10.00%、NT$30、NT$300、6.67；Prospecting Social 1.80%、5.00%、NT$50、NT$1,000、2.00；Retargeting Display 2.50%、10.00%、NT$40、NT$400、6.25。",
      "at": "2026-10-18T07:18:25Z"
    },
    {
      "sequence": 4,
      "action": "套用 CPA 與 ROAS 雙重門檻逐列判讀。",
      "observable_result": "Brand Search 與 Retargeting Display 達標；Prospecting Social 的 CPA 與 ROAS 都未達標。",
      "at": "2026-10-18T07:18:50Z"
    },
    {
      "sequence": 5,
      "action": "撰寫資料界線與下一步。",
      "observable_result": "說明彙總資料無法單獨證明素材、受眾或版位的因果，並提出縮小預算、固定條件進行單一變因測試、後續觀察 CPA 與 ROAS。",
      "at": "2026-10-18T07:19:20Z"
    },
    {
      "sequence": 6,
      "action": "完成 Markdown 成品並依 rubric 五項規則自評。",
      "observable_result": "五項規則逐項通過，成品可由 CSV 與公式重算驗證。",
      "at": "2026-10-18T07:20:20Z"
    }
  ],
  "hints": [
    {
      "source": "learner-page",
      "detail": "單元頁提供雙重門檻、Prospecting Social 的完整判讀示範，以及資料界線與下一步的寫法。"
    },
    {
      "source": "learner-asset",
      "detail": "模板提供數據摘要、判讀與建議的結構；rubric 提供五項完成標準。"
    }
  ],
  "blocks": [],
  "recovery": [],
  "artifact": {
    "path": "trials/g4-output/metrics-table.md",
    "sha256": "38e01086bd5fec6e4e3cfa73c8d7ad079d40ed1f651105c5f52e8f687660b6c2",
    "complete": true,
    "verifiable": true,
    "acceptance_result": "PASS"
  },
  "result": {
    "status": "PASS",
    "completed_at": "2026-10-18T07:20:45Z",
    "notes": "三個活動的五項指標、達標判讀、資料界線與下一步均已完成；依 learner-facing rubric 自評五項皆通過。"
  }
}
